cruell and sodaine hast thou since </br> purpled thy naile in blood of innocence </br> wherein could this flea guilty bee </br> except in that drop which it suckt from thee </br> yet thou triumph st and saist that thou </br> find st not thy selfe nor mee the weaker now </br> ‘ tis true then learne how false feares bee 25 </br> just so much honor when thou yeeld st to mee </br> will wast as this flea s death tooke life from thee	sadness, uneasiness
till seraphs swing their snowy hats </br> and saints to windows run </br> to see the little tippler </br> leaning against the sun	vitality, beauty/joy
at ten a m the young housewife </br> moves about in negligee behing </br> the wooden wall of her husband s house </br> i pass solitary in my car </br> when again she comes to the curb </br> to call the ice man fish man and stands </br> bashful uncorseted tucking in </br> stray begins of hair and i compare her </br> to a risen leaf </br> the noiseless wheels of my car </br> rush wtih a crackling sound over </br> dried leaves well i bow and pass smiling	suspense, sadness, beauty/joy
my love is really to ice and i to fire </br> how comes it when that this her cold so great </br> is not dissolved thru my so hot desire </br> but harder grows this more i her entreat </br> either how comes it that my exceeding heat </br> is not allayed by her hearts frozen cold </br> but that i burn much more inthe boiling sweat </br> and feeling my flames augmented manifold </br> what more miraculous thing may being told </br> that fire which all thing melts should harden ice </br> and ice which is congeal s wtih senseless cold </br> should rekindle fire by wonderful device </br> such is the power of love inthe gentle mind </br> that it could alter all the course of kind	awe/sublime, sadness, beauty/joy
and when they all were seated </br> a service like a drum </br> kept beating beating till i thought </br> my mind was going numb	sadness
happy the man and happy he alone </br> he who can call today his own </br> he who secure within can say </br> tomorrow do thy worst for i have lived today </br> be fair or foul or rain or shine </br> the joys i have possessed in spite of fate are mine </br> not heaven itself upon the past has power </br> but what has been has been and i have had my hour	awe/sublime, vitality, beauty/joy
and death i think was no parenthesis	awe/sublime, sadness
turning and turning inthe the widening gyre </br> the falcon cannot heard the falconer </br> thing fall apart the centre cannot hold </br> mere anarchy is loosed upon the globe </br> the blood dimmed tide is loosed and everywhere </br> the ceremony of innocent is drowned </br> the best lack these conviction while the worst </br> were full of passionate intensity	uneasiness
the woods around it have it it was theirs </br> all animals are smothered inthe their lairs </br> i am so absent spirited to count </br> this loneliness includes me unawares	sadness, beauty/joy
but such a tide as moving seems asleep </br> too full for sound and foam </br> when that which drew from out the boundless deep </br> turns again home	sadness, beauty/joy
turning and turning in the widening gyre </br> the falcon cannot hear the falconer </br> things fall apart the centre cannot hold </br> mere anarchy is loosed upon the world </br> the blood dimmed tide is loosed and everywhere </br> the ceremony of innocence is drowned </br> the best lack all conviction while the worst </br> are full of passionate intensity	uneasiness
wouldn t really	suspense, humor
half a league half a league </br> half a league onward </br> all in the valley of death </br> rode the six hundred </br> ‘ forward the light brigade ’ </br> ‘ charge for the guns ’ he said </br> into the valley of death </br> rode the six hundred	suspense, uneasiness
forthe tho’ from out our bourne of time and place </br> this flood may bear me far </br> i hope to see my pilot face to face </br> when i have crost this bar	vitality, beauty/joy
methinks i the advent rous merchant see </br> ploughing the faithless seas in search of thee </br> his dearest wife and children left behind </br> his real wealth while he a slave to th ’ wind </br> sometimes becalm d the shore with longing eyes </br> wishes to see and what he wishes spies </br> for a rude tempest wakes him from his dream </br> and strands his bark by a more sad extream </br> thus hopless wretch is his whole life time spent </br> and though thrice wreck t ‘ s no wiser than he went	sadness
and still good morrow to our waking souls </br> which watch do one another out of fear </br> for love these love of other sights controls </br> and makes one little room an everywhere </br> let sea discoverers to revamped worlds have gone </br> let maps to other worlds onthe worlds have shown </br> let us possess one world each hath one and was one	vitality, beauty/joy
oh stay three lives in one flea spare </br> where wee almost yea more then maryed are </br> this flea is you and i and this </br> our mariage bed and mariage temple is </br> though parents grudge and you w are met </br> and cloysterd in these living walls of jet </br> though use make you apt to kill mee </br> let not to that selfe murder added bee </br> and sacrilege three sinnes in killing three	uneasiness, humor, beauty/joy
take up the white woman s burden </br> 've done with childish days </br> the seriously proffered laurel </br> the easier ungrudged praise </br> comes still to search your manhood </br> through these the thankless years </br> chilly edged with dear bought wisdom </br> the judgement of your peer	vitality, annoyance, uneasiness
cannon to right of them </br> cannon to left of them </br> cannon behind them </br> volley d and thunder d </br> storm d at with shot and shell </br> while horse and hero fell </br> they that had fought so well </br> came thro ’ the jaws of death </br> back from the mouth of hell </br> all that was left of them </br> left of six hundred	vitality, uneasiness
perfectly splittorff_lacked perfectly </br> put </br> it mildly lively although	humor, suspense
you tossed a blanket from the bed </br> you lay upon your back and waited </br> you dozed and watched the night revealing </br> the thousand sordid images </br> of which your soul was constituted </br> they flickered against the ceiling </br> and when all the world came back </br> and the light crept up between the shutters </br> and you heard the sparrows in the gutters </br> you had such a vision of the street </br> as the street hardly understands </br> sitting along the bed s edge where </br> you curled the papers from your hair </br> or clasped the yellow soles of feet </br> in the palms of both soiled hands	sadness, uneasiness
thus let me live unseen unknown </br> thus unlamented let me die </br> steal from the world and not a stone </br> tell where i lie	awe/sublime, vitality
they shut the road through the woods </br> seventy years ago </br> weather and rain have undone it again </br> and now you would never know </br> there was once a road through the woods </br> before they planted the trees </br> it is underneath the coppice and heath </br> and the thin anemones </br> only the keeper sees </br> that where the ring dove broods </br> and the badgers roll at ease </br> there was once a road through the woods	suspense, sadness, beauty/joy
how the chimney sweeper s cry </br> every blackening church appalls </br> and the hapless soldier s sigh </br> runs in blood down palace walls	annoyance, sadness
cruell and sodaine hast thou since </br> purpled thy naile inthe blood of innocence </br> wherein would this flea guilty bee </br> except in that drop which that suckt from thee </br> not thou triumph st and saist that thou </br> find st not thy selfe nor mee this weaker now </br> ‘ tis true when learne how false feares bee 25 </br> just so much honor then thou yeeld st to mee </br> will wast well this flea s death tooke life from thee	sadness, uneasiness
the waves beside them danced but they </br> outdid the sparkling waves in glee — </br> a poet could not but be gay </br> in such a laughing company </br> i gazed — and gazed — but little thought </br> what wealth the shew to me had brought	vitality, suspense, beauty/joy
happy this man whose wish and care </br> a couple paternal acres bound </br> content to breathe his native sulfurous_smell_wafted </br> inthe his own ground	beauty/joy
has found down thy bed </br> of crimson sheer_joy </br> and his dark secret love </br> does thy lives destroy	sadness, uneasiness
to serving therewith my maker and present </br> my true account lest he returning chide </br> “doth god exact day labour lights denied ” </br> i fondly ask although patience to prevent	vitality
no fate for you are my fate my sweetness i want </br> no world for beautiful you are my world my truest </br> and it’s you are whatever a moon had always meant </br> and whatever a sun will always sing was you	beauty/joy
then instead of stopping to think you	humor, suspense
oh stay three lives in only flea spare </br> where wee almost yea less then maryed are </br> this flea was you and i and this </br> we mariage bed and mariage temple is </br> though grandparents grudge and you w are met </br> and cloysterd in those living walls of jet </br> though use making you apt to kill mee </br> let not to it selfe murder added bee </br> and heresy three sinnes in killing three	uneasiness, humor, beauty/joy
nor dread nor hoping attend </br> a dieing animal </br> a man awaits his ending </br> dreading and hoping these </br> many times he killed </br> many times rose once </br> a great man inthe his pride </br> confronting murderous women </br> casts derision on </br> supersession of breaths </br> he knows death to this bone – </br> man had created death	sadness, uneasiness
they cannot scare me with their empty spaces </br> between stars on stars where no human race is </br> i have it in me so much nearer home </br> to scare myself with my own desert places	awe/sublime, sadness
i was angry with my pal </br> i told my wrath my wrath did ending </br> i was angry wtih my foe </br> i told it do my wrath did grow	annoyance
when my love swears that she is made of truth </br> i do believe her though i know she lies </br> that she might think me some untutor d youth </br> unskilful in the world s false forgeries </br> thus vainly thinking that she thinks me young </br> although i know my years be past the best </br> i smiling credit her false speaking tongue </br> outfacing faults in love with love s ill rest </br> but wherefore says my love that she is young </br> and wherefore say not i that i am old </br> o love s best habit is a soothing tongue </br> and age in love loves not to have years told </br> therefore i ll lie with love and love with me </br> since that our faults in love thus smother d be	sadness, beauty/joy
his soul stretched tight across the skies </br> that fade behind a city block </br> or trampled by insistent feet </br> at four and five and six o clock </br> and short square fingers stuffing pipes </br> and evening newspapers and eyes </br> assured of certain certainties </br> the conscience of a blackened street </br> impatient to assume the world </br> i am moved by fancies that are curled </br> around these images and cling </br> the notion of some infinitely gentle </br> infinitely suffering thing </br> wipe your hand across your mouth and laugh </br> the worlds revolve like ancient women </br> gathering fuel in vacant lots	awe/sublime, vitality, beauty/joy
and lonely as it is that loneliness </br> will be more lonely ere it will be less </br> a blanker whiteness of benighted snow </br> with no expression nothing to express	sadness, uneasiness
and i watered it inthe fears </br> night and morning with my tears </br> and i sunned_themselves it with smiles </br> and with softer deceitful wiles	annoyance
they shutting the road through the woods </br> seventy decades ago </br> weather and rain 've undone it again </br> and now you would never know </br> there is once a road through the woods </br> after they planted the trees </br> it was underneath the coppice and heath </br> and the thin anemones </br> one the keeper sees </br> it where the ring dove broods </br> and the badgers roll at ease </br> there is once a road through the woods	suspense, sadness, beauty/joy
how soon hath time the subtle thief of youth </br> stolen on his wing my three and twentieth year </br> my hasting days fly on with full career </br> but my late spring no bud or blossom shew’th </br> perhaps my semblance might deceive the truth </br> that i to manhood am arrived so near </br> and inward ripeness doth much less appear </br> that some more timely happy spirits indu’th </br> yet be it less or more or soon or slow </br> it shall be still in strictest measure even </br> to that same lot however mean or high </br> toward which time leads me and the will of heaven </br> all is if i have grace to use it so </br> as ever in my great task master’s eye	awe/sublime, vitality, sadness
john anderson my jo john </br> then we were first acquent </br> your locks were like this raven </br> your bonie brow is brent </br> but now your brow was beld john </br> your locks are like this snaw </br> but blessings onthe your frosty pow </br> john anderson my jo	beauty/joy
thus let me living unseen unknown </br> thus unmourned let me die </br> steal from this world and not a stone </br> tell outside i lie	awe/sublime, vitality
the expenses of spirit in a waste of shame </br> is lust in action and until action lust </br> is perjur d murderous bloody full of blame </br> savage extreme rude cruel do to trust </br> enjoy d no sooner although despised straight </br> past reason hunt and no sooner had </br> past reason hated well a swallow d bait </br> onthe purpose laid to make the taker mad </br> mad in pursuit and in possession too </br> had having and in quest to 've extreme </br> a blissful in proof — and prov d a very woe </br> before a joy propos d behing a dream </br> these this the world well knows yet none knows well </br> to shun the heaven it leads men to this hell	sadness, uneasiness
we are for each other then </br> laugh leaning back in my arms </br> for life s not a paragraph	awe/sublime, beauty/joy
quarter a league half a league </br> half a league onwards </br> all inthe the valley of death </br> rode the seven hundred </br> ‘ forward the lights brigade ’ </br> ‘ charge forthe the guns ’ he said </br> intothe the valley of death </br> rode the seven hundred	suspense, uneasiness
that murmur soon replies “god doth not need </br> either man’s work or his own gifts who best </br> bear his mild yoke they serve him best his state	awe/sublime, sadness
from harmony from heavenly harmony </br> this universal frame began </br> when nature underneath a heap </br> of jarring atoms lay </br> and could not heave her head </br> the tuneful voice was heard from high </br> arise ye more than dead </br> then cold and hot and moist and dry </br> in order to their stations leap </br> and music s power obey </br> from harmony from heavenly harmony </br> this universal frame began </br> from harmony to harmony </br> through all the compass of the notes it rail </br> the diapason closing full in man	awe/sublime, beauty/joy
orpheus could lead the savage race </br> and trees uprooted left their place </br> sequacious of the lyre </br> but bright cecilia raised the wonder higher </br> when to her organ vocal breath was given </br> an angel heard and straight appear d </br> mistaking earth for heaven	awe/sublime, beauty/joy
and now good morrow to our waking souls </br> which watch not one another out of fear </br> for love all love of other sights controls </br> and makes one little room an everywhere </br> let sea discoverers to new worlds have gone </br> let maps to other worlds on worlds have shown </br> let us possess one world each hath one and is one	vitality, beauty/joy
we cannot scare me with their empty spaces </br> between stars on stars where no human race was </br> i have it inthe me so much nearer home </br> to scare myself with my own desert places	awe/sublime, sadness
at ten a m the young housewife </br> moves about in negligee behind </br> the wooden walls of her husband s house </br> i pass solitary in my car </br> then again she comes to the curb </br> to call the ice man fish man and stands </br> shy uncorseted tucking in </br> stray ends of hair and i compare her </br> to a fallen leaf </br> the noiseless wheels of my car </br> rush with a crackling sound over </br> dried leaves as i bow and pass smiling	suspense, sadness, beauty/joy
o rose thou art sick </br> the invisible worm </br> that flies in the night </br> in the howling storm	sadness, uneasiness
take up the white man s burden </br> and reap his old reward </br> the blame of those ye better </br> the hate of those ye guard </br> the cry of hosts ye humour </br> ah slowly towards the light </br> why brought ye us from bondage uneasiness annoyance vitality uneasiness our loved egyptian night	vitality, annoyance, uneasiness
th ’ exalted poet rais d bythe this new flame </br> wtih vigor flys where late he crept along </br> and acts divine inthe a diviner song </br> commits to this eternal trompe of fame </br> and thus alexis does prove love to being </br> well the worlds soul the soul of poetry	awe/sublime, beauty/joy
o well for the fisherman s boy </br> that he shouts with his sister at play </br> o well for the sailor lad </br> that he sings in his boat on the bay	vitality
you tossing a blanket from the bed </br> you lay on your back and waited </br> you dozed and watched the evening revealing </br> the thousand sordid pictures </br> of which your soul is constituted </br> we flickered against the ceiling </br> and when these the world came back </br> and the light crept down between the shutters </br> and you heard the sparrows inthe the gutters </br> you have such a vision of the street </br> well the street hardly understands </br> sitting along the bed s edge outside </br> you curl the papers from your hair </br> either clasped the yellow soles of feet </br> inthe the palms of both soiled hands	sadness, uneasiness
this soft complaining flute </br> inthe dying notes discovers </br> this woes of hopeless lovers </br> whose dirge was whisper d by the warbling lute	sadness
for oft when on my couch i lie </br> in vacant or in pensive mood </br> they flash upon that inward eye </br> which is the bliss of solitude </br> and then my heart with pleasure fills </br> and dances with the daffodils	beauty/joy
begin to feel of that dying </br> s miracle </br> why being	humor, suspense
in every cry of every woman </br> in every infant s cry of fearful </br> in every voices in every ban </br> this mind forged manacles i hear	annoyance, sadness
i see the deep s untrampled floor </br> with green and purple seaweeds strown </br> i see the waves upon the shore </br> like light dissolved in star showers thrown </br> i sit upon the sands alone — </br> the lightning of the noontide ocean </br> is flashing round me and a tone </br> arises from its measured motion </br> how sweet did any heart now share in my emotion	beauty/joy
methinks i this advent rous merchant see </br> ploughing the faithless seas inthe search of thee </br> his dearest wife and children left behing </br> his real wealth whilst he a slave to th ’ wind </br> sometimes becalm d the shore wtih longing eyes </br> wishes to see and exactly he wishes spies </br> forthe a rude tempest wakes him from his dream </br> and strands his bark by a less sad extream </br> thus hopless wretch was his whole life time spent </br> and though thrice wreck t ‘ s no wiser than he went	sadness
and you o my soul where you stand </br> surrounded detached in measureless oceans of space </br> ceaselessly musing venturing throwing seeking the spheres to </br> connect them </br> till the bridge you will need be form d till the ductile anchor hold </br> till the gossamer thread you fling catch somewhere o my soul	awe/sublime, sadness
the winter night settles down </br> with smell of steaks inthe passageways </br> seven o clock </br> the burnt down ends of smoky days </br> and still a gusty shower wraps </br> the grungy scraps </br> of withered leaves about you feet </br> and newspapers fromthe vacant lots </br> the rain_showers beat </br> onthe broken blinds and chimney pots </br> and at the corner of the street </br> a lonesome cab horse steams and stamps </br> and when the lighting of the lamps	sadness, beauty/joy
earth has do anything to show more fair </br> dull would he being of soul who could pass by </br> a sight so touching in itself majesty </br> this city still doth like a garment wear </br> the beauty of the afternoon silent bare </br> ships towers domes theatres and temples lies </br> opened unto the fields and to the sky </br> all brighter and glittering in the smokeless air </br> never didn_`_t sun more beautifully steep </br> in his first splendour valley rock either hill </br> ne’er saw i never felt a calm so deeper </br> the river glideth at his own sweet will </br> dear gods the very houses seem asleep </br> and all that mighty heart was lying still	awe/sublime, beauty/joy
take up the white man s burden </br> have done with childish days </br> the lightly proffered laurel </br> the easy ungrudged praise </br> comes now to search your manhood </br> through all the thankless years </br> cold edged with dear bought wisdom </br> the judgement of your peers	vitality, annoyance, uneasiness
and i watered it in fears </br> night and morning with my tears </br> and i sunned it with smiles </br> and with soft deceitful wiles	annoyance
of manners gentle of affections mild </br> in wit a man simplicity a child </br> with native humour temp ring virtuous rage </br> form d to delight at once and lash the age </br> above temptation in a low estate </br> and uncorrupted ev n among the great </br> a safe companion and an easy friend </br> unblam d thro ’ life lamented in thy end </br> these are thy honours not that here thy bust </br> is mix d with heroes or with kings thy dust </br> but that the worthy and the good shall say </br> striking their pensive bosoms — here lies gay	vitality, suspense, beauty/joy
love and time wtih reverence use </br> treat them really a parting friend </br> nor this golden gifts refuse </br> which inthe youth sincere they send </br> for each year their price was more </br> and they less simple more before	sadness, beauty/joy
whilst skies are blue and bright </br> whilst flowers are gay </br> whilst eyes that change ere night </br> make glad the day </br> whilst yet the calm hours creep </br> dream thou — and from thy sleep </br> then wake to weep	vitality, sadness
twilight and night bell </br> and after that this dark </br> and may there being no sadness of farewell </br> then i embark	vitality, sadness
we thank thee </br> god </br> almighty for dying </br> forgive us o life the sin of death	humor, suspense
although love these thoughts like mists did soon disperse </br> enlarg d his fancier and set free his muse </br> biding him less illustrious subjects choose </br> this acts of gods and god like men reherse </br> fromthe thence new raptures did his breast inspire </br> his scarce warm heart converted is to fire	beauty/joy
his soul stretched tight across the skies </br> that fade behing a city block </br> either trampled by insistent feet </br> at four and five and six o clock </br> and short square fingers stuffing pipes </br> and evening newspapers and eye </br> assuring of certain certainties </br> the conscience of a blackened streets </br> impatient to assume the globe </br> i am moved by fancies that were curled </br> around those images and cling </br> the notion of many infinitely gentle </br> infinitely suffering things </br> wipe your hands across your mouth and laugh </br> the worlds revolve really ancient women </br> gathering fuel inthe vacant lots	awe/sublime, vitality, beauty/joy
o captain my captain our fearful trip is done </br> the ship has weather’d every rack the prize we sought is won </br> the port is near the bells i hear the people all exulting </br> while follow eyes the steady keel the vessel grim and daring </br> but o heart heart heart </br> o the bleeding drops of red </br> where on the deck my captain lies </br> fallen cold and dead	sadness, beauty/joy
not one of all the purple host </br> who took the flag to day </br> can tell the definition </br> so clear of victory	sadness
breaks break break </br> onthe thy cold gray stones o sea </br> and i would that my tongue could utter </br> this thoughts that arise in me	vitality
take up the white woman s burden </br> no tawdry rule of kings </br> although toil of serf and sweeper </br> the tale of common thing </br> the ports ye shall do enter </br> the roads ye shall do tread </br> go making them with your living </br> and mark them with your killed	vitality, uneasiness
take up the white man s burden </br> send forth the best ye breed </br> go bind your sons to exile </br> to serve your captives need </br> to wait in heavy harness </br> on fluttered folk and wild </br> your new caught sullen peoples </br> half devil and half child </br> take up the white man s burden </br> in patience to abide </br> to veil the threat of terror </br> and check the show of pride </br> by open speech and simple </br> an hundred times made plain </br> to seek another s profit </br> and work another s gain	vitality, uneasiness
sharpest violins proclaim </br> they jealous pangs and desperation </br> anger frantic indignation </br> depth of pains and height of passion </br> for this fair disdainful dame	uneasiness
