virtue how fragile </br> friendship how rare </br> i love how he sells poor happiness </br> for proud despair </br> but we thought they were falling soon </br> survive their joy and all </br> what we call ours	awe/sublime, sadness
take the burden of the white man </br> savage wars of peace </br> fill your mouth with famine </br> and say the disease stop </br> and when your goal is closest </br> the end for others wanted </br> watch laziness and pagan madness </br> lower all your hopes	vitality, uneasiness
i wandered every charter street </br> near where the chartered thames flows </br> a mark on every face i meet </br> marks of weakness marks of unhappiness	sadness
is there for honest poverty </br> who turns his head and who </br> the cowardly slave - we overtake him </br> we dare to be poor for one </br> for a 'that a' a 'who </br> our sorrows obscure an 'a' who </br> rank is just the stamp of guinea </br> man is the gowd for a 'who	vitality, sadness
he has no future but himself </br> its infinite realms contain </br> his enlightened past to perceive </br> new periods of pain	sadness
how can those vague terrified fingers grow </br> the feathered glory of her sagging thighs </br> and how can the body be lying in this white race </br> but feel the strange heart beating where it is	suspense, uneasiness
which hammer which chain </br> in which furnace was your brain </br> what is the anvil that terror seizes </br> dare his mortal terrors clasp	uneasiness
rose leaves when the rose died </br> are crammed for the beloved bed </br> and so your thoughts when you're gone </br> love itself will sleep	sadness, beauty/joy
pause pause pause </br> at the foot of your rocks o sea </br> but the tender grace of a dead day </br> will never come back to me	vitality, sadness
o </br> baby </br> i	suspense, humor
shining star would i be faithful like you - </br> not in lonely splendor hung up at night </br> and watch with eternal eyelids parted </br> like the sleepless hermit nature patient </br> moving waters to their priestly task </br> pure ablutions around the human coasts of the earth </br> or looking at the new fallen soft mask </br> of snow on the mountains and the moors - </br> no, but still stable, still unchangeable </br> pillow on the mature breast of my beautiful love </br> forever feel its gentle fall and its swell </br> forever awake in gentle turmoil </br> again to hear his tender breath </br> and thus never live - or else faint to death	awe/sublime, vitality, sadness, beauty/joy
in vain in vain - the hour of composition </br> falls without resistance, the muse obeys power </br> she comes she comes the sand throne here </br> of the primitive night and the old chaos </br> before its golden clouds fall apart </br> and all her different rainbows are dying </br> the spirit shoots its momentary fires in vain </br> the meteor falls and in a flash expires </br> like one by one to the stump of dread medea </br> diseased stars disappear from the ethereal plane </br> like the eyes of argus by the wand of hermes opprest </br> closed one by one to eternal rest </br> thus to his felt approach and his secret power </br> art after art comes out and all is night </br> see the truth hidden in his old leaked cave </br> mountains of casuistry heaps o er his head </br> philosophy that relied on the sky before </br> is reduced to its second cause and is no longer </br> the physics of metaphysics demands the defense </br> and the metaphysical appeals for help in the sense </br> see the mystery of mathematics fly </br> in vain they watch become dizzy and die </br> religion blushing veils its sacred fires </br> and morality expires unexpectedly </br> so that the public nor the private flame dares to shine </br> neither the human spark is left nor a divine glimpse </br> where your dreaded empire chaos is restored </br> the light dies before your uncreative word </br> your great anarch hand let the curtain fall </br> and the universal darkness buries everything	suspense, sadness, uneasiness
of this theater of worlds in which we stay </br> my love as the viewer sits ydly </br> seeing me that all the contests are playing </br> variously disguising my troubled minds </br> sometimes i rejoice when a happy occasion suits me </br> and mask in myrth lyke at a comedy </br> soone after when my joy of sorrow floats </br> i cry and make my misfortunes a tragedy </br> yet she looks at me with a constant eye </br> do not rejoice in my merth nor regret my sweetie </br> but when i laugh she laughs and when i cry </br> she laughs and still hardens her heart </br> what then can move her if neither merth nor mone </br> she is not a woman but a stone without meaning	sadness, beauty/joy
my blood approves </br> and kisses are a better fate </br> that wisdom </br> lady i swear by all the flowers don't cry </br> - the best gesture of my brain is less than </br> your eyelids flutter what says	beauty/joy
i taste a liquor never brewed </br> mugs collected in the pearl </br> not all tanks on the rhine </br> give such alcohol	vitality, beauty/joy
music when sweet voices die </br> vibrates in memory - </br> smells when sweet violets get sick </br> live in the sense that they accelerate	sadness, beauty/joy
after hae i rov d by bonie doon </br> see woodbine string </br> and the ilka bird sang his luve </br> and how do i have mine </br> wi 'lightsome heart i pu d a rose </br> on its thorny tree </br> but my cause the liver remains my rose </br> and left the thorn with me </br> wi 'lightsome heart i pu d a rose </br> a morning in june </br> and sae i thrived in the morning </br> and it was late or noon	sadness, beauty/joy
my heart leaps when i see </br> a rainbow in the sky </br> it was also when my life started </br> so is it now i am a man </br> so be it when i get old </br> or let me die </br> the child is the father of man </br> and i could wish that my days were </br> bound each to each by natural piety	vitality, beauty/joy
surely a revelation is at hand </br> surely the second coming is at hand </br> the second coming is hardly those words </br> when a vast image of spiritus mundi </br> cloud my sight somewhere in the desert sands </br> a form with a lion's body and a man's head </br> a blank and ruthless gaze like the sun </br> move her slow thighs as all around her </br> shadows of indignant desert birds </br> darkness falls but now i know </br> that twenty centuries of stony sleep </br> were vexed to the nightmare by a rocking cradle </br> and what a rude beast his hour finally comes </br> leans towards bethlehem to be born	suspense, uneasiness
i wonder by my faith what you and me </br> until we love if we haven't weaned </br> but sucked the pleasures of the countryside childishly </br> or we sniffed in the den of the seven sleepers </br> it's true, but all pleasures are meant </br> if ever a beauty that i saw </br> what i wanted and got was just a dream from you	beauty/joy
how sad to be someone </br> how public like a frog </br> to say your name all day </br> in an admiring bog	humor, sadness
bright burning tyger tyger </br> in the night forests </br> what an immortal hand or eyes </br> dare to frame your terrible symmetry	awe/sublime, beauty/joy
some might complain of being cold </br> like me when this sweet day passed </br> whose lost heart has aged too soon </br> insults with this untimely moan </br> they might complain - because i'm a </br> that men do not like - and yet regret </br> unlike that day when the sun </br> must on her set of stainless glory </br> will linger although appreciated as a joy in the memory still	sadness
"i met a traveler from an ancient country </br> who said two vast, trunkless stone legs </br> to stand in the desert near them on the sand </br> half-pressed a broken face lies whose frown </br> and wrinkled lip and cold command sneer </br> say that his sculptor has read these passions </br> that still survive engraved on these lifeless things </br> the hand that laughed at them and the heart that fed them </br> and on the pedestal these words appear </br> ""my name is the king of kings ozymandias </br> look at my works, you are powerful and desperate ” </br> nothing else remains around decay </br> of this colossal infinite and naked wreck </br> the lonely and flat sands extend far away"	suspense, sadness, uneasiness
as all the heavens were a bell </br> and be just an ear </br> and me and silence a strange race </br> lonely castaway here	awe/sublime, sadness
the flower that smiles today </br> tomorrow dies </br> all we wish to stay </br> tent then fly </br> what is the delight of this world </br> the lightning that laughs at the night </br> in short, even as brilliant	awe/sublime, sadness
you see your birkie ca d a lord </br> wha struts around and looks at an 'a' who </br> the hundreds worship at his word </br> he is but a coof for a 'who </br> for a 'that a' a 'who </br> his ribbon star an 'a' who </br> the independent-minded man </br> he looks and laughs about it	vitality, humor
my captain does not answer his lips are pale and still </br> my father does not feel my arm he has neither pulse nor will </br> the ship is anchored safe and sound her voyage is over and over </br> from a scary journey, the winning ship arrives with the won item </br> exult on the shores and ring the bells </br> but me with a sad step </br> walk on the bridge my captain is lying </br> fell cold and died	vitality, sadness
ah how sweet to love </br> ah how gay is young desire </br> and what pleasant pains we experience </br> when we first approach the fire of love </br> the pains of love be sweeter away </br> than all other pleasures	vitality, beauty/joy
the morning becomes aware </br> faint smells of beer </br> of the street trampled by sawdust </br> with all his muddy feet pressing </br> at the first coffee stands </br> with the other masquerades </br> this time resumes </br> we think of all hands </br> that raise dull undertones </br> in a thousand furnished rooms	vitality, beauty/joy
i carry your heart i carry it in my heart	beauty/joy
a silent patient spider </br> i mark where on a small promontory it was isolated </br> mark how to explore the vast vacant environment </br> it throws a filament of filament forward out of itself </br> never unroll them without ever accelerating them	vitality, sadness
but most in the midnight streets i hear </br> how the curse of the young prostitute </br> breath the newborn's tear </br> and withers the wedding hearse with wounds	annoyance, sadness
i carry your heart with me i carry it </br> my heart i'm never without him nowhere </br> i will you go my dear and all that is done </br> it's only me that you do my darling </br> i fear	beauty/joy
bright burning tyger tyger </br> in the night forests </br> what an immortal hand or eyes </br> could frame your terrible symmetry	awe/sublime, beauty/joy
sunset and evening star </br> and a clear call for me </br> and can there be any moan from the bar </br> when i go to sea	vitality, beauty/joy
what passion cannot uplift and appease music </br> when the jubal hit the shell okay </br> his brothers who were listening stood around </br> and wonder about their faces fell </br> worship that heavenly sound </br> less than a god they thought he couldn't inhabit </br> in the hollow of this shell </br> who spoke so nicely and so well </br> what passion cannot uplift and appease music	suspense, beauty/joy
how he conquered die </br> on whose forbidden ear </br> the distant stumps of triumph </br> breaking down anguished and clear	sadness
the sun is hot the sky is clear </br> the waves dance fast and shine </br> the blue islands and the snow-capped mountains carry </br> the transparent power of purple midi </br> the breath of the damp earth is light </br> around its unexpanded buds </br> like many voices of one delight </br> the winds the birds the ocean floods </br> the voice of the city itself is sweet like loneliness	vitality, beauty/joy
i tell you hopeless sorrow is passionless </br> that only unbelieving desperate men </br> half taught in anguish in the midnight air </br> to ascend the throne of god in a noisy fit </br> of cries and reproaches in the middle of the desert </br> in souls as countries are silent and naked </br> under the vertical glare of whitening eyes </br> from absolute heavens, the man with the deep heart expresses </br> sorrow for your dead in silence as in death - </br> most like a set of monumental statues </br> in the eternal watch and woe without movement </br> until it crumbles to dust </br> touch it marble eyelids are not wet </br> if he could cry he could arise and go	sadness
marke but this chip and walk in this </br> how little is what you deny me </br> he sucks me first and now sucks you </br> and in this chip our two bloods mingled with bees </br> you know that can't be said </br> a sinner neither ashamed nor loss of a young girl </br> yet it comes before courting </br> and pampering d swells with a blood made of two </br> and alas it's more than we would do	humor, beauty/joy
a shiver in the kidneys engenders there </br> the broken wall the roof and the tower on fire </br> and agamemnon dead being so taken </br> so overpowered by the raw blood of the air </br> did she put her knowledge with her power </br> before the indifferent beak can let her down	uneasiness
since feeling is the first </br> who pays attention </br> to the syntax of things </br> will never kiss you completely </br> to be completely stupid </br> while spring is in the world	sadness
old age is </br> a small flight </br> bird biters </br> skimming </br> bare trees above a glacis of snow </br> win and fail </br> they are shaken </br> by a dark wind </br> but what </br> on tough weeds </br> the herd has rested </br> the snow </br> is covered in broken </br> seeds </br> and the temperate wind </br> by a shrill </br> abundance piping	suspense, beauty/joy
"so let's pray that he comes </br> how come it will be for a 'who </br> what meaning and what is worth the earth </br> must have the gree an ""a"" which </br> for a 'that a' a 'who </br> it still happens for an 'that </br> this man to man o ers the world </br> will the brothers be for one"	vitality, beauty/joy
and the majestic ships continue </br> to their haven under the hill </br> but o for the contact of a missing hand </br> and the sound of a voice that is still	vitality, beauty/joy
i hear america sing the various songs that i hear </br> those of the mechanics each singing his own as it should be happy and strong </br> the carpenter singing his own while measuring his board or beam </br> mason sings his as he prepares for work or leaves work </br> the boatman singing what belongs to him in his boat the sailor </br> sing on the steamboat deck </br> the shoemaker who sings seated on his bench the hatter sings like </br> he is standing </br> the song of the woodcutter the plowman is on his way in the morning </br> or at midday intermission or at sunset </br> the delicious song of the mother or the young wife at work </br> or the girl sewing or washing </br> each singing what is his and no one else </br> by day what belongs to the day - at night the festival of young people </br> friendly rugged fellows </br> singing with open mouth their loud melodious songs	vitality, beauty/joy
and then a board of reason broke </br> and i fell from the bottom to the bottom </br> and hit a world with every dive </br> and finished knowing then	awe/sublime, sadness
when the stars have thrown their spears </br> and watered the sky with their tears </br> did he smile his work to see </br> did the one who made the lamb make you	awe/sublime
and then i heard them lift a box </br> and crack in my soul </br> with those same lead boots again </br> then space started ringing	sadness
unhappy wretch who discovered rowing first </br> what kind of revenge awaits you in store </br> so nebats sons that israel has led astray </br> meet a severe reward on the last day </br> a strange unheard-of judgment that you will find </br> who thus made all human species to sin	annoyance, uneasiness
"if i when my wife sleeps </br> and the baby and kathleen </br> sleep </br> and the sun is a white disk of flame </br> in silky mists above shining trees - </br> if i am in my north room </br> grotesquely naked dance </br> in front of my mirror </br> waving my shirt around my head </br> and sing softly to me </br> ""i am alone </br> i was born to be alone </br> i'm better then ” </br> if i admire my arms my face </br> my shoulders flank the buttocks </br> against the shades drawn in yellow -"	suspense, humor
dead so dead </br> were </br> good for	humor, suspense
but oh what art can teach </br> what the human voice can achieve </br> the praise of the sacred organ </br> notes inspiring holy love </br> notes that steal their heavenly ways </br> to mend the choirs above	awe/sublime, beauty/joy
"""advance the light brigade"" </br> was there a man dismayed at </br> not if the soldier knew </br> someone had an error d </br> they must not answer </br> they don't want to know why </br> theirs but do and die </br> in the valley of death </br> ride the six hundred"	uneasiness
cannon to the right of them </br> cannon to the left of them </br> cannon in front of them </br> volley d and thunder d </br> storm with shot and shells </br> boldly they rolled and well </br> in the jaws of death </br> in hell mouth </br> ride the six hundred	vitality, uneasiness
when i consider how my light is spent </br> before half of my days in this dark and vast world </br> and this talent which is death to hide </br> housed with me useless although my soul more bent	suspense, sadness
o captain my captain get up and hear the bells </br> get up - for you the flag is thrown - for you the bugle trills </br> for you bouquets and wreaths of ribbon - for you the shores a crowd </br> for you they call the swaying mass, their impatient faces turn </br> here captain dear father </br> that arm under your head </br> it's a dream that on the bridge </br> you fell cold and died	vitality, sadness
of all the poisons that the earth fertilizes </br> e er still produced or monsters that she gave birth </br> nothing for mankind has ever been so fatal </br> how you cursed the gold of their care and their sin	annoyance
deep sleep at night study and ease </br> mixt soft leisure set </br> and the innocence that pleases the most </br> with meditation	beauty/joy
when the first alexis gave pleasure in verse </br> his muse in low but graceful numbers walks t </br> and from time to time a little proudly t </br> but never aim for a noble flight </br> the herds the groves the gentle streams purling </br> adorned his song and were his highest themes	beauty/joy
whose herds of milk whose fields of bread </br> whose flocks provide him with clothes </br> whose trees in summer give it shade </br> in the winter fire	beauty/joy
yet if you enter the woods </br> of a late summer evening </br> when the night air cools on the trout ponds </br> where the otter hisses his mate </br> they don't fear the men in the woods </br> because they see so little </br> you will hear the kick of a horse's feet </br> and the rustle of a skirt in the dew </br> galloping regularly </br> misty solitudes </br> as if they knew perfectly </br> the old road lost through the woods </br> but there is no road through the woods	sadness, beauty/joy
now the harbinger of the bright morning star </br> come dance from the east and lead with her </br> the flowery can which throws from its green knees </br> the yellow cowslip and the pale primrose </br> generous hello that inspires </br> joy and youth and warm desire </br> the woods and groves are part of your dress </br> hill and valley boast of your blessing </br> so we greet you with our first song </br> and welcome you and wish you long	vitality, beauty/joy
yet now the despair itself is sweet </br> even though the winds and the waters are </br> i could lie down like a tired child </br> and cry care life </br> that i endured and that i must endure </br> until death like sleep can steal from me </br> and i could feel myself in the hot air </br> my cheek is cooling and i hear the sea </br> breathe o er my brain dying its last monotony	sadness
success is counted the sweetest </br> by those who never succeed </br> understand a nectar </br> requires the greatest need	beauty/joy
love like full and high spring tides </br> swells in every juvenile vein </br> but each tide provides less </br> until they shrink again </br> if an age flow appears	sadness
death </br> is strictly </br> scientist </br> artificial amp </br> bad legal amp	humor, suspense
alas i have neither hope nor health </br> neither inner peace nor calm around </br> nor this content surpassing wealth </br> the wise man in meditation has found </br> and walked with crowned inner glory - </br> neither fame nor power nor love nor leisure </br> others i see who these surround - </br> smiling they live and call the pleasure of life - </br> for me this cup was distributed to another extent	annoyance, sadness
pain has an element of white </br> he can't remember </br> when it started or if there was </br> a day when it wasn't	sadness
i was walking lonely like a cloud </br> that floats above valleys and hills </br> when all of a sudden i saw a crowd </br> a crowd of dancing daffodils </br> by the lake under the trees </br> ten thousand dancing in the breeze	beauty/joy
if you can keep your head when all around you </br> lose theirs and you blame </br> if you can trust yourself when all the men doubt you </br> but take into account their doubts too </br> if you can wait and not be tired while waiting </br> or be lying so as not to lie </br> or be hated don't give in to hatred </br> and yet not to appear too beautiful nor to speak too wise	vitality, beauty/joy
in what depths or distant skies </br> burnt the fire of your eyes </br> on what wings does he dare to aspire </br> what the hand dares to grab the fire	beauty/joy
some say the world will end in fire </br> some say in the mirror </br> of what i tasted desire </br> i stand with those who favor fire </br> but if he were to perish twice </br> i think i know enough about hate </br> say that for the destruction of ice </br> it's also great </br> and would suffice	awe/sublime, humor
my face in your eye appears in mine </br> and real simple hearts make faces rest </br> where can we find two better hemispheres </br> without acute north without decay to west </br> everything that dies was not mixed equally </br> if our two loves are one or you and me </br> love so alike that none is released, no one can die	awe/sublime, vitality, beauty/joy
again i see the despis of the celestial beauty </br> a hagg like hell with more highly priz gold </br> the faith of men betrays their prince and their sold country </br> their god denies everything for the idol's gold	uneasiness, annoyance, sadness
let the world crisp like a hugging knife </br> locked in and do no harm </br> in this tight hand of love now soft and warm </br> and hear no sound of human conflict </br> after the snap of life close to life - </br> i'm leaning on you darling fearlessly </br> and feel as secure as guarded by a charm </br> against the blow of the socialites which so rages </br> are weak to hurt still very white </br> the lilies of our lives can reassure </br> their flowers from their accessible roots </br> alone to the heavenly dews which do not fall less </br> pushing straight out of man's reach on the hill </br> only god who made us rich can make us poor	awe/sublime, beauty/joy
intoxicated with air am i </br> and debauchery of dew </br> spending endless summer days </br> melted blue inns	vitality, beauty/joy
sighs of blown lovers </br> just gently lift the heart </br> ev n the tears they shed alone </br> heal like a balm dripping their intelligent </br> lovers when they lose their breath </br> bleed into death easy	beauty/joy
because dying is	humor, suspense
suddenly the big wings flap again </br> above the staggering girl her thighs caressed </br> by the dark canvases her neck caught in her bill </br> he holds his breast helplessly on his chest	suspense, uneasiness
who will say that i am not </br> the happy genius of my house	humor
the brown waves of fog throw me </br> crooked faces from down the street </br> and tear up a passerby with muddy skirts </br> a aimless smile hovering in the air </br> and disappears at roof level	sadness, uneasiness
how i love you let me count the ways </br> i love you in depth, in width and in height </br> my soul can reach out feeling out of sight </br> for the purposes of being and ideal grace </br> i love you on an everyday level </br> quietest need by sun and candle light </br> i love you freely as men strive for good </br> i love you purely as they turn away from praise </br> i love you with the passion put to use </br> in my old sorrows and with the faith of my childhood </br> i love you with a love that i seemed to lose </br> with my lost saints i love you with the breath </br> smiles tears all my life and if god chooses </br> i will love you better after death	awe/sublime, beauty/joy
go on like the shining stars </br> and sparkle on the milky way </br> they stretched in line endlessly </br> along a bay </br> ten thousand i saw at a glance </br> shaking his head in a playful dance	beauty/joy
and what shoulder and what art </br> could twist the nerves in your heart </br> and when your heart started to beat </br> what a scary hand and what scary feet	uneasiness
