virtue how fragile </br> friendship how rare </br> i love how he sells poor happiness </br> for proud despair </br> but we thought they were falling soon </br> survive their joy and all </br> what we call ours	awe/sublime, sadness
my mind is too weak - mortality </br> weighs heavily on me like involuntary sleep </br> and every pinnacle imagined and stiff </br> divine hardship tells me i must die </br> like a sick eagle looking at the sky </br> but it's a sweet luxury to cry </br> that i don't have the cloudy winds to keep </br> fresh for the morning eye opening </br> so dark conceived glories of the brain </br> bring around the heart an indescribable quarrel </br> so do these wonders a most dizzying pain </br> which mixes greek grandeur with grossness </br> waste of time spent - with a rough hand - </br> a sun - a shadow of a magnitude	sadness
virtue how frail it is </br> friendship how rare </br> love how it sells poor bliss </br> for proud despair </br> but we though soon they fall </br> survive their joy and all </br> which ours we call	awe/sublime, sadness
take up the white man s burden </br> the savage wars of peace </br> fill full the mouth of famine </br> and bid the sickness cease </br> and when your goal is nearest </br> the end for others sought </br> watch sloth and heathen folly </br> bring all your hopes to nought	vitality, uneasiness
i wandered through each chartered street </br> near where the chartered thames does flow </br> a mark in every face i meet </br> marks of weakness marks of woe	sadness
is there for honest poverty </br> that hings his head an ’ a ’ that </br> the coward slave — we pass him by </br> we dare be poor for a ’ that </br> for a ’ that an ’ a ’ that </br> our toils obscure an ’ a ’ that </br> the rank is but the guinea s stamp </br> the man s the gowd for a ’ that	vitality, sadness
it has no future but itself </br> its infinite realms contain </br> its past enlightened to perceive </br> new periods of pain	sadness
how can those terrified vague fingers push </br> the feathered glory from her loosening thighs </br> and how can body laid in that white rush </br> but feel the strange heart beating where it lies	suspense, uneasiness
what the hammer what the chain </br> in what furnace was thy brain </br> what the anvil what dread grasp </br> dare its deadly terrors clasp	uneasiness
rose leaves when the rose is dead </br> are heaped for the beloved s bed </br> and so thy thoughts when thou art gone </br> love itself shall slumber on	sadness, beauty/joy
break break break </br> at the foot of thy crags o sea </br> but the tender grace of a day that is dead </br> will never come back to me	vitality, sadness
o </br> baby </br> i	suspense, humor
bright star would i were stedfast as thou art— </br> not in lone splendour hung aloft the night </br> and watching with eternal lids apart </br> like nature’s patient sleepless eremite </br> the moving waters at their priestlike task </br> of pure ablution round earth’s human shores </br> or gazing on the new soft fallen mask </br> of snow upon the mountains and the moors— </br> no—yet still stedfast still unchangeable </br> pillow’d upon my fair love’s ripening breast </br> to feel for ever its soft fall and swell </br> awake for ever in a sweet unrest </br> still still to hear her tender taken breath </br> and so live ever—or else swoon to death	awe/sublime, vitality, sadness, beauty/joy
in vain in vain — the all composing hour </br> resistless falls the muse obeys the pow r </br> she comes she comes the sable throne behold </br> of night primæval and of chaos old </br> before her fancy s gilded clouds decay </br> and all its varying rain bows die away </br> wit shoots in vain its momentary fires </br> the meteor drops and in a flash expires </br> as one by one at dread medea s strain </br> the sick ning stars fade off th ’ ethereal plain </br> as argus ’ eyes by hermes ’ wand opprest </br> clos d one by one to everlasting rest </br> thus at her felt approach and secret might </br> art after art goes out and all is night </br> see skulking truth to her old cavern fled </br> mountains of casuistry heap d o er her head </br> philosophy that lean d on heav n before </br> shrinks to her second cause and is no more </br> physic of metaphysic begs defence </br> and metaphysic calls for aid on sense </br> see mystery to mathematics fly </br> in vain they gaze turn giddy rave and die </br> religion blushing veils her sacred fires </br> and unawares morality expires </br> for public flame nor private dares to shine </br> nor human spark is left nor glimpse divine </br> lo thy dread empire chaos is restor d </br> light dies before thy uncreating word </br> thy hand great anarch lets the curtain fall </br> and universal darkness buries all	suspense, sadness, uneasiness
of this worlds theatre in which we stay </br> my love like the spectator ydly sits </br> beholding me that all the pageants play </br> disguysing diversly my troubled wits </br> sometimes i joy when glad occasion fits </br> and mask in myrth lyke to a comedy </br> soone after when my joy to sorrow flits </br> i waile and make my woes a tragedy </br> yet she beholding me with constant eye </br> delights not in my merth nor rues my smart </br> but when i laugh she mocks and when i cry </br> she laughs and hardens evermore her heart </br> what then can move her if nor merth nor mone </br> she is no woman but a senceless stone	sadness, beauty/joy
my blood approves </br> and kisses are a better fate </br> than wisdom </br> lady i swear by all flowers don t cry </br> —the best gesture of my brain is less than </br> your eyelids flutter which says	beauty/joy
i taste a liquor never brewed </br> from tankards scooped in pearl </br> not all the vats upon the rhine </br> yield such an alcohol	vitality, beauty/joy
music when soft voices die </br> vibrates in the memory — </br> odours when sweet violets sicken </br> live within the sense they quicken	sadness, beauty/joy
aft hae i rov d by bonie doon </br> to see the woodbine twine </br> and ilka bird sang o ’ its luve </br> and sae did i o ’ mine </br> wi ’ lightsome heart i pu d a rose </br> upon its thorny tree </br> but my fause luver staw my rose </br> and left the thorn wi ’ me </br> wi ’ lightsome heart i pu d a rose </br> upon a morn in june </br> and sae i flourished on the morn </br> and sae was pu d or noon	sadness, beauty/joy
my heart leaps up when i behold </br> a rainbow in the sky </br> so was it when my life began </br> so is it now i am a man </br> so be it when i shall grow old </br> or let me die </br> the child is father of the man </br> and i could wish my days to be </br> bound each to each by natural piety	vitality, beauty/joy
surely some revelation is at hand </br> surely the second coming is at hand </br> the second coming hardly are those words out </br> when a vast image out of spiritus mundi </br> troubles my sight somewhere in sands of the desert </br> a shape with lion body and the head of a man </br> a gaze blank and pitiless as the sun </br> is moving its slow thighs while all about it </br> reel shadows of the indignant desert birds </br> the darkness drops again but now i know </br> that twenty centuries of stony sleep </br> were vexed to nightmare by a rocking cradle </br> and what rough beast its hour come round at last </br> slouches towards bethlehem to be born	suspense, uneasiness
i wonder by my troth what thou and i </br> did till we loved were we not weaned till then </br> but sucked on country pleasures childishly </br> or snorted we in the seven sleepers’ den </br> ’twas so but this all pleasures fancies be </br> if ever any beauty i did see </br> which i desired and got ’twas but a dream of thee	beauty/joy
how dreary to be somebody </br> how public like a frog </br> to tell your name the livelong day </br> to an admiring bog	humor, sadness
tyger tyger burning bright </br> in the forests of the night </br> what immortal hand or eye </br> dare frame thy fearful symmetry	awe/sublime, beauty/joy
some might lament that i were cold </br> as i when this sweet day is gone </br> which my lost heart too soon grown old </br> insults with this untimely moan </br> they might lament — for i am one </br> whom men love not — and yet regret </br> unlike this day which when the sun </br> shall on its stainless glory set </br> will linger though enjoyed like joy in memory yet	sadness
i met a traveller from an antique land </br> who said two vast and trunkless legs of stone </br> stand in the desert near them on the sand </br> half sunk a shattered visage lies whose frown </br> and wrinkled lip and sneer of cold command </br> tell that its sculptor well those passions read </br> which yet survive stamped on these lifeless things </br> the hand that mocked them and the heart that fed </br> and on the pedestal these words appear </br> ‘ my name is ozymandias king of kings </br> look on my works ye mighty and despair ’ </br> nothing beside remains round the decay </br> of that colossal wreck boundless and bare </br> the lone and level sands stretch far away	suspense, sadness, uneasiness
as all the heavens were a bell </br> and being but an ear </br> and i and silence some strange race </br> wrecked solitary here	awe/sublime, sadness
the flower that smiles to day </br> to morrow dies </br> all that we wish to stay </br> tempts and then flies </br> what is this world s delight </br> lightning that mocks the night </br> brief even as bright	awe/sublime, sadness
ye see yon birkie ca d a lord </br> wha struts an ’ stares an ’ a ’ that </br> tho ’ hundreds worship at his word </br> he s but a coof for a ’ that </br> for a ’ that an ’ a ’ that </br> his ribband star an ’ a ’ that </br> the man o ’ independent mind </br> he looks an ’ laughs at a ’ that	vitality, humor
my captain does not answer his lips are pale and still </br> my father does not feel my arm he has no pulse nor will </br> the ship is anchor’d safe and sound its voyage closed and done </br> from fearful trip the victor ship comes in with object won </br> exult o shores and ring o bells </br> but i with mournful tread </br> walk the deck my captain lies </br> fallen cold and dead	vitality, sadness
ah how sweet it is to love </br> ah how gay is young desire </br> and what pleasing pains we prove </br> when we first approach love s fire </br> pains of love be sweeter far </br> than all other pleasures are	vitality, beauty/joy
the morning comes to consciousness </br> of faint stale smells of beer </br> from the sawdust trampled street </br> with all its muddy feet that press </br> to early coffee stands </br> with the other masquerades </br> that time resumes </br> one thinks of all the hands </br> that are raising dingy shades </br> in a thousand furnished rooms	vitality, beauty/joy
i carry your heart i carry it in my heart	beauty/joy
a noiseless patient spider </br> i mark d where on a little promontory it stood isolated </br> mark d how to explore the vacant vast surrounding </br> it launch d forth filament filament filament out of itself </br> ever unreeling them ever tirelessly speeding them	vitality, sadness
but most through midnight streets i hear </br> how the youthful harlot s curse </br> blasts the new born infant s tear </br> and blights with plagues the marriage hearse	annoyance, sadness
i carry your heart with me i carry it in </br> my heart i am never without it anywhere </br> i go you go my dear and whatever is done </br> by only me is your doing my darling </br> i fear	beauty/joy
tyger tyger burning bright </br> in the forests of the night </br> what immortal hand or eye </br> could frame thy fearful symmetry	awe/sublime, beauty/joy
sunset and evening star </br> and one clear call for me </br> and may there be no moaning of the bar </br> when i put out to sea	vitality, beauty/joy
what passion cannot music raise and quell </br> when jubal struck the chorded shell </br> his listening brethren stood around </br> and wondering on their faces fell </br> to worship that celestial sound </br> less than a god they thought there could not dwell </br> within the hollow of that shell </br> that spoke so sweetly and so well </br> what passion cannot music raise and quell	suspense, beauty/joy
as he defeated dying </br> on whose forbidden ear </br> the distant strains of triumph </br> break agonized and clear	sadness
the sun is warm the sky is clear </br> the waves are dancing fast and bright </br> blue isles and snowy mountains wear </br> the purple noon s transparent might </br> the breath of the moist earth is light </br> around its unexpanded buds </br> like many a voice of one delight </br> the winds the birds the ocean floods </br> the city s voice itself is soft like solitude s	vitality, beauty/joy
i tell you hopeless grief is passionless </br> that only men incredulous of despair </br> half taught in anguish through the midnight air </br> beat upward to god’s throne in loud access </br> of shrieking and reproach full desertness </br> in souls as countries lieth silent bare </br> under the blanching vertical eye glare </br> of the absolute heavens deep hearted man express </br> grief for thy dead in silence like to death— </br> most like a monumental statue set </br> in everlasting watch and moveless woe </br> till itself crumble to the dust beneath </br> touch it the marble eyelids are not wet </br> if it could weep it could arise and go	sadness
marke but this flea and marke in this </br> how little that which thou deny st me is </br> it suck d me first and now sucks thee </br> and in this flea our two bloods mingled bee </br> thou know st that this cannot be said </br> a sinne nor shame nor losse of maidenhead </br> yet this enjoyes before it wooe </br> and pamper d swells with one blood made of two </br> and this alas is more then wee would doe	humor, beauty/joy
a shudder in the loins engenders there </br> the broken wall the burning roof and tower </br> and agamemnon dead being so caught up </br> so mastered by the brute blood of the air </br> did she put on his knowledge with his power </br> before the indifferent beak could let her drop	uneasiness
since feeling is first </br> who pays any attention </br> to the syntax of things </br> will never wholly kiss you </br> wholly to be a fool </br> while spring is in the world	sadness
old age is </br> a flight of small </br> cheeping birds </br> skimming </br> bare trees above a snow glaze </br> gaining and failing </br> they are buffeted </br> by a dark wind </br> but what </br> on harsh weedstalks </br> the flock has rested </br> the snow </br> is covered with broken </br> seedhusks </br> and the wind tempered </br> by a shrill </br> piping of plenty	suspense, beauty/joy
then let us pray that come it may </br> as come it will for a ’ that </br> that sense and worth o er a ’ the earth </br> shall bear the gree an ’ a ’ that </br> for a ’ that an ’ a ’ that </br> it s coming yet for a ’ that </br> that man to man the world o er </br> shall brothers be for a ’ that	vitality, beauty/joy
and the stately ships go on </br> to their haven under the hill </br> but o for the touch of a vanish d hand </br> and the sound of a voice that is still	vitality, beauty/joy
i hear america singing the varied carols i hear </br> those of mechanics each one singing his as it should be blithe and strong </br> the carpenter singing his as he measures his plank or beam </br> the mason singing his as he makes ready for work or leaves off work </br> the boatman singing what belongs to him in his boat the deckhand </br> singing on the steamboat deck </br> the shoemaker singing as he sits on his bench the hatter singing as </br> he stands </br> the wood cutter s song the ploughboy s on his way in the morning </br> or at noon intermission or at sundown </br> the delicious singing of the mother or of the young wife at work </br> or of the girl sewing or washing </br> each singing what belongs to him or her and to none else </br> the day what belongs to the day — at night the party of young </br> fellows robust friendly </br> singing with open mouths their strong melodious songs	vitality, beauty/joy
and then a plank in reason broke </br> and i dropped down and down </br> and hit a world at every plunge </br> and finished knowing then	awe/sublime, sadness
when the stars threw down their spears </br> and watered heaven with their tears </br> did he smile his work to see </br> did he who made the lamb make thee	awe/sublime
and then i heard them lift a box </br> and creak across my soul </br> with those same boots of lead again </br> then space began to toll	sadness
unhappy wretch who first found out the oar </br> what kind of vengeance rests for thee in store </br> if nebats son that israel led astray </br> meet a severe reward at the last day </br> some strange unheard of judgement thou wilt find </br> who thus hast caus d to sin all humane kind	annoyance, uneasiness
if i when my wife is sleeping </br> and the baby and kathleen </br> are sleeping </br> and the sun is a flame white disc </br> in silken mists above shining trees — </br> if i in my north room </br> danse naked grotesquely </br> before my mirror </br> waving my shirt round my head </br> and singing softly to myself </br> “i am lonely lonely </br> i was born to be lonely </br> i am best so ” </br> if i admire my arms my face </br> my shoulders flanks buttocks </br> against the yellow drawn shades —	suspense, humor
death if death </br> were </br> good for	humor, suspense
but oh what art can teach </br> what human voice can reach </br> the sacred organ s praise </br> notes inspiring holy love </br> notes that wing their heavenly ways </br> to mend the choirs above	awe/sublime, beauty/joy
‘ forward the light brigade ’ </br> was there a man dismay d </br> not tho ’ the soldier knew </br> some one had blunder d </br> their s not to make reply </br> their s not to reason why </br> their s but to do and die </br> into the valley of death </br> rode the six hundred	uneasiness
cannon to right of them </br> cannon to left of them </br> cannon in front of them </br> volley d and thunder d </br> storm d at with shot and shell </br> boldly they rode and well </br> into the jaws of death </br> into the mouth of hell </br> rode the six hundred	vitality, uneasiness
when i consider how my light is spent </br> ere half my days in this dark world and wide </br> and that one talent which is death to hide </br> lodged with me useless though my soul more bent	suspense, sadness
o captain my captain rise up and hear the bells </br> rise up—for you the flag is flung—for you the bugle trills </br> for you bouquets and ribbon’d wreaths—for you the shores a crowding </br> for you they call the swaying mass their eager faces turning </br> here captain dear father </br> this arm beneath your head </br> it is some dream that on the deck </br> you’ve fallen cold and dead	vitality, sadness
of all the poisons that the fruitful earth </br> e er yet brought forth or monsters she gave birth </br> nought to mankind has e er so fatal been </br> as thou accursed gold their care and sin	annoyance
sound sleep by night study and ease </br> together mixt sweet recreation </br> and innocence which most does please </br> with meditation	beauty/joy
when first alexis did in verse delight </br> his muse in low but graceful numbers walk t </br> and now and then a little proudly stalk t </br> but never aim d at any noble flight </br> the herds the groves the gentle purling streams </br> adorn d his song and were his highest theams	beauty/joy
whose herds with milk whose fields with bread </br> whose flocks supply him with attire </br> whose trees in summer yield him shade </br> in winter fire	beauty/joy
yet if you enter the woods </br> of a summer evening late </br> when the night air cools on the trout ringed pools </br> where the otter whistles his mate </br> they fear not men in the woods </br> because they see so few </br> you will hear the beat of a horse’s feet </br> and the swish of a skirt in the dew </br> steadily cantering through </br> the misty solitudes </br> as though they perfectly knew </br> the old lost road through the woods </br> but there is no road through the woods	sadness, beauty/joy
now the bright morning star day’s harbinger </br> comes dancing from the east and leads with her </br> the flowery may who from her green lap throws </br> the yellow cowslip and the pale primrose </br> hail bounteous may that dost inspire </br> mirth and youth and warm desire </br> woods and groves are of thy dressing </br> hill and dale doth boast thy blessing </br> thus we salute thee with our early song </br> and welcome thee and wish thee long	vitality, beauty/joy
yet now despair itself is mild </br> even as the winds and waters are </br> i could lie down like a tired child </br> and weep away the life of care </br> which i have borne and yet must bear </br> till death like sleep might steal on me </br> and i might feel in the warm air </br> my cheek grow cold and hear the sea </br> breathe o er my dying brain its last monotony	sadness
success is counted sweetest </br> by those who ne er succeed </br> to comprehend a nectar </br> requires sorest need	beauty/joy
love like spring tides full and high </br> swells in every youthful vein </br> but each tide does less supply </br> till they quite shrink in again </br> if a flow in age appear	sadness
death </br> is strictly </br> scientific </br> amp artificial amp </br> evil amp legal	humor, suspense
alas i have nor hope nor health </br> nor peace within nor calm around </br> nor that content surpassing wealth </br> the sage in meditation found </br> and walked with inward glory crowned — </br> nor fame nor power nor love nor leisure </br> others i see whom these surround — </br> smiling they live and call life pleasure — </br> to me that cup has been dealt in another measure	annoyance, sadness
pain has an element of blank </br> it cannot recollect </br> when it began or if there were </br> a day when it was not	sadness
i wandered lonely as a cloud </br> that floats on high over vales and hills </br> when all at once i saw a crowd </br> a host of dancing daffodills </br> along the lake beneath the trees </br> ten thousand dancing in the breeze	beauty/joy
if you can keep your head when all about you </br> are losing theirs and blaming it on you </br> if you can trust yourself when all men doubt you </br> but make allowance for their doubting too </br> if you can wait and not be tired by waiting </br> or being lied about don’t deal in lies </br> or being hated don’t give way to hating </br> and yet don’t look too good nor talk too wise	vitality, beauty/joy
in what distant deeps or skies </br> burnt the fire of thine eyes </br> on what wings dare he aspire </br> what the hand dare seize the fire	beauty/joy
some say the world will end in fire </br> some say in ice </br> from what i’ve tasted of desire </br> i hold with those who favor fire </br> but if it had to perish twice </br> i think i know enough of hate </br> to say that for destruction ice </br> is also great </br> and would suffice	awe/sublime, humor
my face in thine eye thine in mine appears </br> and true plain hearts do in the faces rest </br> where can we find two better hemispheres </br> without sharp north without declining west </br> whatever dies was not mixed equally </br> if our two loves be one or thou and i </br> love so alike that none do slacken none can die	awe/sublime, vitality, beauty/joy
again i see the heavenly fair despis d </br> a hagg like hell with gold more highly priz d </br> mens faith betray d their prince and country sold </br> their god deny d all for the idol gold	uneasiness, annoyance, sadness
let the world s sharpness like a clasping knife </br> shut in upon itself and do no harm </br> in this close hand of love now soft and warm </br> and let us hear no sound of human strife </br> after the click of the shutting life to life — </br> i lean upon thee dear without alarm </br> and feel as safe as guarded by a charm </br> against the stab of worldlings who if rife </br> are weak to injure very whitely still </br> the lilies of our lives may reassure </br> their blossoms from their roots accessible </br> alone to heavenly dews that drop not fewer </br> growing straight out of man s reach on the hill </br> god only who made us rich can make us poor	awe/sublime, beauty/joy
inebriate of air am i </br> and debauchee of dew </br> reeling through endless summer days </br> from inns of molten blue	vitality, beauty/joy
sighs which are from lovers blown </br> do but gently heave the heart </br> ev n the tears they shed alone </br> cure like trickling balm their smart </br> lovers when they lose their breath </br> bleed away in easy death	beauty/joy
cause dying is	humor, suspense
a sudden blow the great wings beating still </br> above the staggering girl her thighs caressed </br> by the dark webs her nape caught in his bill </br> he holds her helpless breast upon his breast	suspense, uneasiness
who shall say i am not </br> the happy genius of my household	humor
the brown waves of fog toss up to me </br> twisted faces from the bottom of the street </br> and tear from a passer by with muddy skirts </br> an aimless smile that hovers in the air </br> and vanishes along the level of the roofs	sadness, uneasiness
